<?xml version="1.0" encoding="UTF-8" standalone="no"?>
<root xmlns:xsi="http://www.w3.org/2001/XMLSchema-instance" xsi:noNamespaceSchemaLocation="WFInfo.xsd">
    <workflow name="ArticleProduction">
        <simple_action auto="false" name="Publication" role="Editor"/>
        <simple_action auto="true" name="Writing" role="Journalist">
            <sub_action name_ref="Checking"/>
        </simple_action>
        <simple_action auto="false" name="Revising" role="Journalist">
            <sub_action name_ref="Checking"/>
        </simple_action>
        <simple_action auto="false" name="Checking" role="Editor">
            <sub_action name_ref="Revising"/>
            <sub_action name_ref="Publication"/>
        </simple_action>
    </workflow>
    <process date="2015-10-15T00:16:40.000+02:00" workflow="ArticleProduction">
        <action_status date="2015-10-15T09:12:40.000" name="Writing" taken_in_charge="true" terminated="true">
            <actor name="Eva Bianchi" role="Journalist"/>
        </action_status>
        <action_status date="2015-10-17T04:53:40.000" name="Checking" taken_in_charge="true" terminated="true">
            <actor name="Joseph Green" role="Editor"/>
        </action_status>
        <action_status date="2015-10-18T03:09:40.000" name="Revising" taken_in_charge="true" terminated="true">
            <actor name="Beppe Baresi" role="Journalist"/>
        </action_status>
        <action_status name="Checking" taken_in_charge="false" terminated="false"/>
    </process>
    <process date="2015-10-09T21:03:40.000" workflow="ArticleProduction">
        <action_status date="2015-10-10T19:35:40.000" name="Writing" taken_in_charge="true" terminated="true">
            <actor name="Eva Bianchi" role="Journalist"/>
        </action_status>
        <action_status name="Checking" taken_in_charge="true" terminated="false">
            <actor name="Anna White" role="Editor"/>
        </action_status>
    </process>
    <process date="2015-10-16T10:20:40.000" workflow="ArticleProduction">
        <action_status date="2015-10-17T10:24:40.000" name="Writing" taken_in_charge="true" terminated="true">
            <actor name="Eva Bianchi" role="Journalist"/>
        </action_status>
        <action_status date="2015-10-17T10:26:40.000" name="Checking" taken_in_charge="true" terminated="true">
            <actor name="Anna White" role="Editor"/>
        </action_status>
        <action_status date="2015-10-18T09:33:40.000" name="Revising" taken_in_charge="true" terminated="true">
            <actor name="Eva Bianchi" role="Journalist"/>
        </action_status>
        <action_status date="2015-10-20T05:40:40.000" name="Checking" taken_in_charge="true" terminated="true">
            <actor name="Anna White" role="Editor"/>
        </action_status>
        <action_status name="Publication" taken_in_charge="false" terminated="false"/>
    </process>
    <process date="2015-10-13T08:42:40.000" workflow="ArticleProduction">
        <action_status date="2015-10-14T11:46:40.000" name="Writing" taken_in_charge="true" terminated="true">
            <actor name="Beppe Baresi" role="Journalist"/>
        </action_status>
        <action_status date="2015-10-16T10:16:40.000" name="Checking" taken_in_charge="true" terminated="true">
            <actor name="Henry H Francese" role="Editor"/>
        </action_status>
        <action_status name="Publication" taken_in_charge="false" terminated="false"/>
    </process>
    <process date="2015-10-21T11:28:40.000" workflow="ArticleProduction">
        <action_status name="Writing" taken_in_charge="false" terminated="false"/>
    </process>
    <process date="2015-10-12T16:30:40.000" workflow="ArticleProduction">
        <action_status date="2015-10-12T20:19:40.000" name="Writing" taken_in_charge="true" terminated="true">
            <actor name="Eva Bianchi" role="Journalist"/>
        </action_status>
        <action_status date="2015-10-13T19:05:40.000" name="Checking" taken_in_charge="true" terminated="true">
            <actor name="Anna White" role="Editor"/>
        </action_status>
        <action_status date="2015-10-15T11:31:40.000" name="Revising" taken_in_charge="true" terminated="true">
            <actor name="Beppe Baresi" role="Journalist"/>
        </action_status>
        <action_status date="2015-10-15T23:53:40.000" name="Checking" taken_in_charge="true" terminated="true">
            <actor name="Joseph Green" role="Editor"/>
        </action_status>
        <action_status name="Revising" taken_in_charge="false" terminated="false"/>
    </process>
    <process date="2015-10-09T03:29:40.000" workflow="ArticleProduction">
        <action_status date="2015-10-10T21:35:40.000" name="Writing" taken_in_charge="true" terminated="true">
            <actor name="Eva Bianchi" role="Journalist"/>
        </action_status>
        <action_status date="2015-10-12T05:29:40.000" name="Checking" taken_in_charge="true" terminated="true">
            <actor name="Anna White" role="Editor"/>
        </action_status>
        <action_status date="2015-10-12T09:50:40.000" name="Publication" taken_in_charge="true" terminated="true">
            <actor name="Joseph Green" role="Editor"/>
        </action_status>
    </process>
    <process date="2015-10-19T20:52:40.000" workflow="ArticleProduction">
        <action_status name="Writing" taken_in_charge="false" terminated="false"/>
    </process>
</root>
